name,category,rate,price,time,price_numeric,price_text
Good Morning Paris: Breakfast at Market & City Tour,Guided tour,0.0,"194,097 per person",4 hours,194097,per person
Paris: Walking Tour of Artsy Batignolles,Private tour,0.0,"166,394 per person",3 hours,166394,per person
Paris: Full-Day Customized Private Walking Tour with a Local,Private tour,0.0,"653,009 per group up to 2",3.5 hours,653009,per group up to 2
Invader Hunt Street Art Tour,Guided tour,0.0,"60,185 per person",135 minutes,60185,per person
Paris: Private Tour to Montmartre with Eiffel Tower & Lunch,Private tour,5.0,"308,449 per person",7 hours,308449,per person
Versailles: Versailles Palace and Garden Private Guided Tour,Private tour,0.0,"413,021 per person",3 hours,413021,per person
World War I Battlefields & War Museum of Meaux Day Tour,Private tour,5.0,"2,082,406 per group up to 2",10 hours,2082406,per group up to 2
Paris: Le Marais Neighborhood Historical Guided Walk,Guided tour,0.0,"120,370 per person",2 hours,120370,per person
Paris : visite de Paris à bord de la Citroën DS,Private tour,0.0,"413,773 per group up to 4",2 - 3 hours,413773,per group up to 4
Palace of Versailles: Guided Louis XIV Hidden Palace Tour,Guided tour,0.0,"209,143 per person",3 hours,209143,per person
Paris Private Full Day Tour - Tickets to Louvre & Lunch,Private tour,5.0,"362,616 per person",7.5 hours,362616,per person
Paris: Marais + Covered Passages + Pigalle Walking Tours,Other experience,0.0,"40,610 per person",3 hours,40610,per person
From Paris: Versailles Guided Private Day Trip by Train,Private tour,0.0,"561,227 per person",5 hours,561227,per person
Paris: L'Oiseau Paradis Cabaret Show with Lunch and Drinks,Entry ticket,0.0,"210,648 per person",3.5 hours,210648,per person
Le Marais: Explore Old Paris with a Local Host,Private tour,4.0,"207,992 per person",3 hours,207992,per person
Paris: Bachelor(ette) Challenge City Exploration Game,Other experience,0.0,"22,569 per person",095 days,22569,per person
Paris: Segway Tour,Guided tour,5.0,"118,866 per person",2 hours,118866,per person
Paris: Belleville and Le Marais Private Walking Tour,Private tour,3.3,"130,903 per person",3 hours,130903,per person
Paris: The Mona Lisa Curse Outdoor Escape Game,Other experience,3.8,"12,022 per person",1.5 hours,12022,per person
Paris: E-Tricycle Guided Sightseeing Private Tour,Guided tour,5.0,"73,727 per person",1 hour,73727,per person
Invalides War Museum the World Wars Guided Tour,Guided tour,4.7,"189,794 per person",2 hours,189794,per person
Paris: Cooking Class with Ferrandi at Galeries Lafayette,Workshop or class,0.0,"195,602 per person",2 hours,195602,per person
Paris Champs-Élysées 2-Hour Private Walking Tour,Private tour,4.7,"225,694 per person",2 hours,225694,per person
Paris: Marais Walks Self-Guided Audio Tour,Other experience,3.2,"5,266 per person",2 hours,5266,per person
Paris: History of Crime Smartphone Audio Guide Walking Tour,Other experience,4.4,"13,527 per person",1 hour,13527,per person
Louvre and Musée d'Orsay with Reserved Entry Ticket,Bundle,5.0,"365,234 per person",5.5 hours,365234,per person
Paris: Breakfast Cruise on the Seine River,Water activity,0.0,"112,847 per person",1.5 hours,112847,per person
From Paris: Private Bruges Tour,Private tour,0.0,"1,272,916 per person",12 hours,1272916,per person
"Montmartre, Paris: The Locals' Favorite Arrondissement",Guided tour,4.7,"155,994 per person",3 hours,155994,per person
Artists in Paris: 3 Smartphone Audio Walking Tours,Other experience,5.0,"40,610 per person",3 hours,40610,per person
Paris 6-Hour Private Guided Walking Tour,Private tour,4.3,"376,157 per person",6 hours,376157,per person
Paris: Parisian Picnic Cruise with a Glass of Wine,Guided tour,0.0,"135,417 per person",1.5 hours,135417,per person
Paris Gourmet: Food Tour in South Montmartre,Guided tour,4.2,"164,005 per person",3 hours,164005,per person
Private Tour from Paris to Loire Castles & Michelin Lunch,Private tour,0.0,"2,139,612 per group up to 1",1 day,2139612,per group up to 1
Paris: Self-Guided Outdoor Escape Game and Tour,Other experience,3.8,"9,780 per person",365 days,9780,per person
Paris: Professional Photoshoot with 500+ Photos,Private tour,0.0,"255,787 per person",1 hour,255787,per person
Paris: Gourmet Food Tour & Skip-the-Line Louvre Guided Tour,Day trip,0.0,"207,187 per person",7 hours,207187,per person
Paris : Montmartre Audio Walking Tour and VR Experience,Other experience,0.0,"39,933 per person",2.5 hours,39933,per person
Paris: Luggage Delivery Service to Avignon & Aix en Provence,Transfer,0.0,"857,638 per person",1 day,857638,per person
Paris : Mission Anniversary Outdoor Game,Entry ticket,0.0,"58,681 per group up to 6",2.5 hours,58681,per group up to 6
Paris: City Exploration Game 'Peter Pan',Other experience,0.0,"37,601 per group up to 6",095 days,37601,per group up to 6
Paris: A Très Délicieux Food Tour in Charming Le Marais,Private tour,3.6,"259,990 per person",3 hours,259990,per person
Paris: Montmartre Private Guided Walking Tour,Private tour,0.0,"247,511 per person",2 hours,247511,per person
From Paris: Monet Impressionism Tour to Giverny by Minibus,Private tour,4.7,"1,805,555 per group up to 8",5 hours,1805555,per group up to 8
Marais Walking Tour: Lifestyle in Paris,Guided tour,5.0,"132,407 per person",2.5 hours,132407,per person
Paris: Funlympics Games in Montmartre,Guided tour,0.0,"58,681 per person",1 hour,58681,per person
Paris: The Alchemist City Exploration Smartphone Game,Other experience,0.0,"60,170 per group up to 6",095 days,60170,per group up to 6
Paris: Photography Class for Beginners,Private tour,0.0,"436,342 per group up to 1",3 hours,436342,per group up to 1
"Paris: City Tour Eiffel Tower, Musée d’Orsay & River Cruise",Bundle,4.9,"284,375 per person",9 hours,284375,per person
Paris Walking Tour: The Art of Seduction in Montmartre,Guided tour,0.0,"109,838 per person",2 hours,109838,per person
Paris: Museum of the Art and History of Judaism Entry Ticket,Private tour,0.0,"302,430 per person",2 - 6 hours,302430,per person
Paris: Private Bike Tour of Old Town and Top Attractions,Private tour,0.0,"327,407 per person",2 - 6 hours,327407,per person
The Best Paris Foodie Tour,Guided tour,4.0,"269,329 per person",2.5 hours,269329,per person
Paris: Guided Family Old Town Tour and Grévin Museum Ticket,Private tour,4.4,"264,815 per person",2 - 3.5 hours,264815,per person
"Paris: ""Live, Laugh, Love along the Seine"" City Game",Other experience,4.6,"10,517 per person",170 minutes,10517,per person
Paris: Covered Passages 2-Hour Scavenger Hunt,Private tour,3.0,"662,037 per group up to 4",2 hours,662037,per group up to 4
Paris: Skip-the-Line Private 2-Hour Louvre Tour,Private tour,4.8,"376,157 per person",2 hours,376157,per person
Private Wine and Cheese Tasting in Paris,Private tour,5.0,"233,217 per person",2 hours,233217,per person
Paris: Vintage Shops Guided Tour,Guided tour,5.0,"22,569 per person",1.5 hours,22569,per person
Paris: Bachelorette Party Scavenger Hunt Mobile Game,Other experience,0.0,"103,819 per group up to 6",2 hours,103819,per group up to 6
Paris: Outdoor Foxtrail Treasure Hunt Experience,Other experience,4.5,"43,634 per person",2 hours,43634,per person
Paris: Private Food Tour in St. Germain,Private tour,0.0,"278,356 per person",3 hours,278356,per person
Versailles: Palace Trip by Motorcycle with Sidecar,Private tour,5.0,"448,379 per person",3 - 7 hours,448379,per person
Paris: Private Skip-the-Lines Orsay and Louvre Museum Tour,Private tour,5.0,"534,143 per person",5 hours,534143,per person
Paris: Hotel de la Marine Visit & Seine River Cruise,Other experience,0.0,"46,643 per person",2.5 - 4 hours,46643,per person
"Paris Combo: Bike Tour, Seine Cruise & Eiffel Tower Ticket",Day trip,3.0,"164,005 per person",7 hours,164005,per person
Paris: Private Walking Tour with a Licensed Local Guide,Guided tour,5.0,"341,551 per person",3 hours,341551,per person
Paris Private Full-Day Tour from Le Havre - Shore Ex.,Private tour,0.0,"1,956,018 per group up to 7",11 hours,1956018,per group up to 7
From Disneyland Paris: Versailles and Paris Full-Day Tour,Other experience,0.0,"188,079 per person",1 day,188079,per person
Paris: Urban Art Murals Walking Tour with an Expert,Guided tour,5.0,"52,662 per person",135 minutes,52662,per person
Paris: Tour de France Bike Ride,Guided tour,0.0,"97,801 per person",2 hours,97801,per person
Paris: Street Art Walking Tour with a Street Artist Guide,Guided tour,0.0,"37,465 per person",1.5 hours,37465,per person
"Paris: Eiffel Tower, Gardens and Palaces Self Guided Tour",Other experience,3.0,"5,266 per person",365 days,5266,per person
Disneyland Paris: Bus Sightseeing Tour in Paris,Guided tour,4.0,"148,958 per person",1 day,148958,per person
Paris: 3-Hour Interactive History Walking Tour,Private tour,5.0,"646,990 per group up to 4",3 hours,646990,per group up to 4
Paris: Latin Quarter Historic Walking Tour,Guided tour,0.0,"120,370 per person",2 hours,120370,per person
Paris: Private Airport Transfer with Vintage Citroën DS 21,Transfer,0.0,"214,951 per group up to 4",1 hour,214951,per group up to 4
Paris: Round-Trip Coach Transfer from Paris to Disneyland,Transfer,3.6,"67,708 per person",1 hour,67708,per person
Paris: Treasures of the Marais Walking Tour,Guided tour,0.0,"73,727 per person",2 hours,73727,per person
Paris: 90-Minute Boules Game in the Park,Private tour,4.6,"312,963 per group up to 1",1.5 hours,312963,per group up to 1
Paris: 2.5-Hour Private City Highlights Kickstart Tour,Private tour,3.8,"130,903 per person",2.5 hours,130903,per person
Paris: VIP Sainte-Chapelle and Conciergerie Guided Tour,Guided tour,5.0,"224,190 per person",2.5 hours,224190,per person
Paris: Private Guided City Tour by Classic Convertible Car,Private tour,0.0,"284,375 per group up to 3",1.5 hours,284375,per group up to 3
Paris: Monmartre Highlights Self-Guided Audio Walking Tour,Other experience,3.4,"14,971 per person",2 days,14971,per person
Paris: Seine Cruise and Eiffel Tower District Walking Tour,Bundle,4.3,"39,256 per person",2 hours,39256,per person
Paris: City Highlights Private Electric Bike Tour with video,Private tour,0.0,"109,838 per person",2 hours,109838,per person
Paris: Photo Walk in Montmartre,Private tour,0.0,"737,268 per group up to 1",3 hours,737268,per group up to 1
Paris: Le Marais Food and Wine Walking Tour,Guided tour,0.0,"150,463 per person",3 hours,150463,per person
Paris: Private Guided Walking Tour of the City Center,Private tour,0.0,"361,111 per person",2.5 hours,361111,per person
Paris by Night Small Group Bike Tour & Boat Cruise,Water activity,5.0,"103,819 per person",4.5 hours,103819,per person
Private tour Paris in Renault 4L electric,Private tour,4.0,"332,523 per person",1.5 hours,332523,per person
Paris: Twilight Wine Tasting Walking Tour in Montmartre,Guided tour,5.0,"150,463 per person",3 hours,150463,per person
Family Joy in Paris Walking Tour,Private tour,0.0,"886,226 per group up to 4",2 hours,886226,per group up to 4
Paris: Romantic Sidecar Tour by Night with Champagne,Private tour,5.0,"609,721 per group up to 2",2 hours,609721,per group up to 2
"Paris: Parisian Picnic with Wine, Cheese and Local Insights",Guided tour,0.0,"88,773 per person",2 hours,88773,per person
Paris: City Exploration Game 'Secret of Paris',Other experience,0.0,"60,170 per group up to 6",095 days,60170,per group up to 6
From Le Havre: Versailles Day Trip and Private Tour,Private tour,0.0,"1,354,166 per group up to 6",11 hours,1354166,per group up to 6
Paris: Premium Fitness Pass with Access to Top Gyms,City card,0.0,"33,989 per person",30 days,33989,per person
Paris : Airport transfer including City Highlights Tour,Private tour,0.0,"631,944 per group up to 3",4 hours,631944,per group up to 3
Paris: Highlights Bike Tour with Wine & Cheese Picnic,Day trip,0.0,"263,310 per person",6 hours,263310,per person
Paris Right Bank 2-Hour Private Walking Tour,Private tour,5.0,"225,694 per person",2 hours,225694,per person
Paris: Private Guided Tour and Transfer to Airport,Private tour,0.0,"1,128,472 per group up to 6",3 - 6 hours,1128472,per group up to 6
From Paris: Normandy Landing Beaches and D-Day Private Tour,Private tour,0.0,"2,369,790 per group up to 4",12 hours,2369790,per group up to 4
Charles de Gaulle Airport: Private Airport Transfer to Paris,Transfer,0.0,"224,190 per group up to 3",1 hour,224190,per group up to 3
Paris: Private Transfer from CDG Airport to Disneyland,Transfer,0.0,"203,125 per group up to 3",40 minutes,203125,per group up to 3
Disneyland Paris and Versailles: Luggage Transfer from Paris,Transfer,0.0,"73,727 per person",1 day,73727,per person
Paris: France Flyover Virtual Reality Smartphone App & Audio,Water activity,0.0,"43,995 per person",2.5 hours,43995,per person
"Paris: ""Saving Marsupilami"" City Exploration Smartphone Game",Other experience,0.0,"37,601 per group up to 6",095 days,37601,per group up to 6
Magnificence on Every Corner - Paris Walking Tour,Private tour,0.0,"660,532 per group up to 4",2 hours,660532,per group up to 4
Paris: Left Bank Highlights Private Sidecar Tour,Private tour,0.0,"267,824 per person",2 hours,267824,per person
From Amsterdam: Private Transfer to Paris,Transfer,0.0,"3,310,183 per group up to 7",6.5 hours,3310183,per group up to 7
Paris: Local Walking Tour in Montmartre with Panoramic View,Guided tour,0.0,"120,370 per person",2 hours,120370,per person
Paris: Private Transfer from CDG Airport to Disneyland,Transfer,5.0,"284,375 per group up to 6",40 minutes,284375,per group up to 6
"Paris: Private, Tailor made, Guided Tour on Vintage Sidecar",Private tour,5.0,"772,597 per person",3 hours,772597,per person
Paris: City Walk and Louvre Museum Tour,Guided tour,5.0,"365,234 per person",5.5 hours,365234,per person
Paris: Montmartre Private Walking Tour,Private tour,4.9,"225,694 per person",2 hours,225694,per person
Disneyland Paris: Private Transfer from or to CDG Airport,Transfer,4.8,"127,893 per group up to 3",35 minutes,127893,per group up to 3
Private Treasure Hunt around Notre Dame for Families & Kids,Private tour,5.0,"646,990 per group up to 4",2 hours,646990,per group up to 4
